,unmasked_text,masked_text,phone_number,target
701,Found some interesting patterns in our endocrine studies involving Transexual person of 97 years. Reach out at 0066 25446214 to talk.,Found some interesting patterns in our endocrine studies involving [GENDER_1] of [AGE_1]. Reach out at [PHONENUMBER_1] to talk.,0066 25446214,O
702,"We regret to inform you, patient with SSN: 756.9141.4537 did not survive the ICU stay. Contact +904.611-949.2086 for further details.","We regret to inform you, patient with SSN: [SSN_1] did not survive the ICU stay. Contact [PHONENUMBER_1] for further details.",+904.611-949.2086,TEL
703,"Dear parents, school will be re-opening in 19901-4178 as per the instructions of health authorities. Please contact us at 03-1092-9747 for detailed information.","Dear parents, school will be re-opening in [ZIPCODE_1] as per the instructions of health authorities. Please contact us at [PHONENUMBER_1] for detailed information.",03-1092-9747,O
704,Hello Elizabeth! Our field trip to the Northwest is confirmed. Bus (CM16EBC) will leave at 17:30 from Reynolds Unions. The fee can be paid in cash or transferred to BE91941601414773 or 16bfrFPYRod9ts2zdbtJN4rpGndgFdrD6J9. Please confirm your availability by emailing back or calling 0197.85930660.,Hello [FIRSTNAME_1]! Our field trip to the [ORDINALDIRECTION_1] is confirmed. Bus ([VEHICLEVRM_1]) will leave at [TIME_1] from [STREET_1]. The fee can be paid in cash or transferred to [IBAN_1] or [BITCOINADDRESS_1]. Please confirm your availability by emailing back or calling [PHONENUMBER_1].,0197.85930660,O
705,"We need to discuss the endocrine findings for the Transexual female in the 51 bracket. Let's talk over the phone, 027 069.0283.","We need to discuss the endocrine findings for the [GENDER_1] in the [AGE_1] bracket. Let's talk over the phone, [PHONENUMBER_1].",027 069.0283,TEL
706,"Thank you for attending the clinical trial briefing. For quick resolution of queries, contact us at caa2:703f:3ea9:a0fe:8da2:ec3a:59e4:8f76 or call us on (270) 5809666.","Thank you for attending the clinical trial briefing. For quick resolution of queries, contact us at [IPV6_1] or call us on [PHONENUMBER_1].",(270) 5809666,O
707,"Hi Gail, I'm confirming that we've received your application for admission into our addiction treatment program. Our staff will reach out to you via your registered number 010.3514641 for the next steps.","Hi [FIRSTNAME_1], I'm confirming that we've received your application for admission into our addiction treatment program. Our staff will reach out to you via your registered number [PHONENUMBER_1] for the next steps.",010.3514641,O
708,"I am requesting information regarding a recent violation of municipal law involving vehicle with VIN number EGJTLSV7NGYR70413 parked at S High Street, 01410-5182. Please notify me on my contact number 00478 26068.","I am requesting information regarding a recent violation of municipal law involving vehicle with VIN number [VEHICLEVIN_1] parked at [STREET_1], [ZIPCODE_1]. Please notify me on my contact number [PHONENUMBER_1].",00478 26068,TEL
709,"By prior arrangement, I have Jovan alongside today as we give you feedback of his/ her year achievements. To make a schedule, could you please contact Adalberto, our administrator, at Billy96@gmail.com or 025 9666-6461. We look forward to meeting you.","By prior arrangement, I have [FIRSTNAME_1] alongside today as we give you feedback of his/ her year achievements. To make a schedule, could you please contact [FIRSTNAME_2], our administrator, at [EMAIL_1] or [PHONENUMBER_1]. We look forward to meeting you.",025 9666-6461,O
710,"Watsicaburgh health officials have noticed an increase in a novel respiratory illness, under monitoring of Facilitator Mr. Jacobs. Reach out to us at 06984.666708 for inquiries.","[CITY_1] health officials have noticed an increase in a novel respiratory illness, under monitoring of [JOBTYPE_1] [PREFIX_1] [LASTNAME_1]. Reach out to us at [PHONENUMBER_1] for inquiries.",06984.666708,O
711,"We want to remind Makenna of your Cognitive Therapy Session. This will take on 1977-09-26T01:42:41.833Z at 12:19 AM. Venue is located at Davis Mills Erdmanshire. Please, if need be, reach us at 00 0489-1111 or Delphia36@gmail.com. We expect your session fee of ﷼662063.29.","We want to remind [FIRSTNAME_1] of your Cognitive Therapy Session. This will take on [DATE_1] at [TIME_1]. Venue is located at [STREET_1] [CITY_1]. Please, if need be, reach us at [PHONENUMBER_1] or [EMAIL_1]. We expect your session fee of [CURRENCYSYMBOL_1][AMOUNT_1].",00 0489-1111,O
712,"Perusing historical constitutional law cases. Found an interesting lead on https://uncomfortable-chap.org/. Care to join, Darrick5? We could discuss details over a call, +21-277.732 2985 suits.","Perusing historical constitutional law cases. Found an interesting lead on [URL_1]. Care to join, [USERNAME_1]? We could discuss details over a call, [PHONENUMBER_1] suits.",+21-277.732 2985,O
713,"Future Assurance Analyst at Ankunding and Sons will be giving a talk on literacy on July 22, 1938 at 20 o'clock. Email Alexa.Wisozk27@yahoo.com or call (86)-1183.0199 for details.",[JOBTITLE_1] at [COMPANYNAME_1] will be giving a talk on literacy on [DATE_1] at [TIME_1]. Email [EMAIL_1] or call [PHONENUMBER_1] for details.,(86)-1183.0199,O
714,"Dear Teacher, we request your consent for the evaluation process via phone +568-565.633 9489 or email Dasia0@yahoo.com. We will not compromise any sensitive information like 6306226786055100 or 187.","Dear Teacher, we request your consent for the evaluation process via phone [PHONENUMBER_1] or email [EMAIL_1]. We will not compromise any sensitive information like [CREDITCARDNUMBER_1] or [CREDITCARDCVV_1].",+568-565.633 9489,TEL
715,Kindly submit S/.769103.82 for the 'Educational Leadership in Modern Classrooms' course offered by Hackett - Gleason. Transfer using KW58NEOE3P522A94625C5K18204743. Questions can be directed to 03 0540-7531.,Kindly submit [CURRENCYSYMBOL_1][AMOUNT_1] for the 'Educational Leadership in Modern Classrooms' course offered by [COMPANYNAME_1]. Transfer using [IBAN_1]. Questions can be directed to [PHONENUMBER_1].,03 0540-7531,O
716,The Intellectual property workshop was great. How can I maintain exclusive rights for my developments post my workshop at Bernardo Groves location? My contact is 068-7642.4066.,The Intellectual property workshop was great. How can I maintain exclusive rights for my developments post my workshop at [STREET_1] location? My contact is [PHONENUMBER_1].,068-7642.4066,O
717,"Franchise partners in East Sussex, 7243758705688241 and 1890132856310426 reported unauthorized charges. Please verify with 2448 717.2156.","Franchise partners in [COUNTY_1], [CREDITCARDNUMBER_1] and [CREDITCARDNUMBER_2] reported unauthorized charges. Please verify with [PHONENUMBER_1].",2448 717.2156,O
718,"Greetings Sherwood, As an Employment Law practitioner, it's vital to maintain strict confidentiality. I’ll be contacting you at 0958-10842799 to further discuss your case.","Greetings [FIRSTNAME_1], As an Employment Law practitioner, it's vital to maintain strict confidentiality. I’ll be contacting you at [PHONENUMBER_1] to further discuss your case.",0958-10842799,O
719,"Patient Demarco North Windler (Intersex person) came to our clinic for an initial psychological evaluation. She's  1 years old, residing at 703 Cummings Glens, Vivianside, Sicily, 59827-2180. Contact: 021.054-6634.","Patient [FIRSTNAME_1] [MIDDLENAME_1] [LASTNAME_1] ([GENDER_1]) came to our clinic for an initial psychological evaluation. She's  [AGE_1] years old, residing at [BUILDINGNUMBER_1] [STREET_1], [CITY_1], [STATE_1], [ZIPCODE_1]. Contact: [PHONENUMBER_1].",021.054-6634,TEL
720,"Dear Patient Hane-Marquardt, We are attempting to confirm an appointment booked on 03/08/2008 at our East Sharonborough facility. Please verify this appointment either by phone +984-869 613.5943 or by replying to this message at Erling_Botsford-Bogan@hotmail.com.","Dear Patient [LASTNAME_1], We are attempting to confirm an appointment booked on [DATE_1] at our [CITY_1] facility. Please verify this appointment either by phone [PHONENUMBER_1] or by replying to this message at [EMAIL_1].",+984-869 613.5943,TEL
721,"Mrs. Schultz, your chemotherapy session is scheduled for December 2, 2017. Reach us at +620.89.011.2655 for further instructions.","[PREFIX_1] [LASTNAME_1], your chemotherapy session is scheduled for [DATE_1]. Reach us at [PHONENUMBER_1] for further instructions.",+620.89.011.2655,O
722,I'm Tried to reach 73-916916-319254-6 for the wellness check-up scheduled for today. Please contact us at 0492-14229255.,I'm Tried to reach [PHONEIMEI_1] for the wellness check-up scheduled for today. Please contact us at [PHONENUMBER_1].,0492-14229255,O
723,"Classroom management plan for Home Loan Account, 1916-05-30T23:35:37.816Z deadline. Secure data with 170.161.237.196, 3cbiuEhtNaYzbPjBTPABH73oEJ2n, 299-57-1600. Direct any concerns or updates via 043 9517 1767.","Classroom management plan for [ACCOUNTNAME_1], [DOB_1] deadline. Secure data with [IPV4_1], [BITCOINADDRESS_1], [SSN_1]. Direct any concerns or updates via [PHONENUMBER_1].",043 9517 1767,O
724,We have organized a seminar to address the newly emerging diseases in Pennsylvania. Join us to stay updated or call at (384) 3934387 for more information.,We have organized a seminar to address the newly emerging diseases in [STATE_1]. Join us to stay updated or call at [PHONENUMBER_1] for more information.,(384) 3934387,O
725,"Hi Evalyn, Regarding the school safety meeting on 13th April, we need a plan to protect our students from cyber threats. I am entrusting you with this task. You will be provided Rial OmaniSeychelles Rupee as project funds. Contact 04-0053 7179 for further queries.","Hi [FIRSTNAME_1], Regarding the school safety meeting on [DATE_1], we need a plan to protect our students from cyber threats. I am entrusting you with this task. You will be provided [CURRENCYNAME_1][CURRENCY_1] as project funds. Contact [PHONENUMBER_1] for further queries.",04-0053 7179,O
726,"Hey, Emory needs your guidance regarding career options. You can reach him at 001-225.9952. Awaiting your response.","Hey, [FIRSTNAME_1] needs your guidance regarding career options. You can reach him at [PHONENUMBER_1]. Awaiting your response.",001-225.9952,O
727,"For any questions regarding the trip to 08372-3892, please contact the Implementation team at +12-568 552 8855.","For any questions regarding the trip to [ZIPCODE_1], please contact the [JOBAREA_1] team at [PHONENUMBER_1].",+12-568 552 8855,O
728,"Classroom management plan for Checking Account requiring 187.245.139.191, 1DMazHdAoqSbKt9jFPJ5XQZmuyJSKsBwmv8y5, 259-96-2023 to be secured and July 8, 1957 submission. Use 32167 for tracking and +799 58-926-8084 in case of a problem.","Classroom management plan for [ACCOUNTNAME_1] requiring [IPV4_1], [BITCOINADDRESS_1], [SSN_1] to be secured and [DOB_1] submission. Use [ZIPCODE_1] for tracking and [PHONENUMBER_1] in case of a problem.",+799 58-926-8084,O
729,We have received your arbitration request regarding account 95291441. A representative will call you at 008 353.7494 to discuss the issue further.,We have received your arbitration request regarding account [ACCOUNTNUMBER_1]. A representative will call you at [PHONENUMBER_1] to discuss the issue further.,008 353.7494,TEL
730,"Please see attached the invoice of our subscription to Jerde, Tromp and Gottlieb's educational leadership journal. It comes to a total of kr349029 plus taxes. Transfer it from account SA1979IU6599925K14528510. Contact Myra if any issues via 095 7583-8024.",Please see attached the invoice of our subscription to [COMPANYNAME_1]'s educational leadership journal. It comes to a total of [CURRENCYSYMBOL_1][AMOUNT_1] plus taxes. Transfer it from account [IBAN_1]. Contact [FIRSTNAME_1] if any issues via [PHONENUMBER_1].,095 7583-8024,O
731,"Dear Cis female, we identified an IP 7cec:e0fa:5cd5:baaa:4f8c:0ebc:7ce1:e2bf involved in questionable activities in our e-learning platform. Please ensure your child conforms to the set guidelines. For queries, reach us at 0566.21384385.","Dear [GENDER_1], we identified an IP [IP_1] involved in questionable activities in our e-learning platform. Please ensure your child conforms to the set guidelines. For queries, reach us at [PHONENUMBER_1].",0566.21384385,O
732,I am Bradley from the Infrastructure department at Ernser Group. I would like to inform you that we are starting a new social service initiative. For more information email Vada.OReilly@yahoo.com or call 9083 346.7222.,I am [FIRSTNAME_1] from the [JOBAREA_1] department at [COMPANYNAME_1]. I would like to inform you that we are starting a new social service initiative. For more information email [EMAIL_1] or call [PHONENUMBER_1].,9083 346.7222,O
733,"We got a request for an oncology consultation for a new patient named Lyla Littel. The contact details include 64-422648-637514-3, 02093-341495.","We got a request for an oncology consultation for a new patient named [FIRSTNAME_1] [LASTNAME_1]. The contact details include [PHONEIMEI_1], [PHONENUMBER_1].",02093-341495,O
734,I have some questions for Elyssa Purdy who was the judge of the event. You can contact her at (72)-4710.9470 or Mauricio72@gmail.com.,I have some questions for [FIRSTNAME_1] [LASTNAME_1] who was the judge of the event. You can contact her at [PHONENUMBER_1] or [EMAIL_1].,(72)-4710.9470,O
