,unmasked_text,masked_text,phone_number,target
635,Internship payments would be made in Australian Dollar. Interns from outside the country can contact our finance division for the exchange rate to the CLP. The contact person for this issue is at 037 983.1348.,Internship payments would be made in [CURRENCY_1]. Interns from outside the country can contact our finance division for the exchange rate to the [CURRENCYCODE_1]. The contact person for this issue is at [PHONENUMBER_1].,037 983.1348,TEL
636,Let's protect our intellectual property rights. Discuss copyright issues with Brittany at 084-0352145.,Let's protect our intellectual property rights. Discuss copyright issues with [FIRSTNAME_1] at [PHONENUMBER_1].,084-0352145,O
637,"Dear Lamar Sage,
We would like to inform you that the vendor portal is now live. Please log in using your IPV4: 117.100.15.25 or IPV6: 025c:5ab5:1db2:41e2:8d85:37ab:ceae:314a address. If you run into any issues, contact our administrator at 00005 52973.","Dear [FIRSTNAME_1] [MIDDLENAME_1],
We would like to inform you that the vendor portal is now live. Please log in using your IPV4: [IPV4_1] or IPV6: [IPV6_1] address. If you run into any issues, contact our administrator at [PHONENUMBER_1].",00005 52973,TEL
638,"Hey Wilfred, did you remember to pay the course fee from account Personal Loan Account? Please check and reply to me on this number: (86) 0206 7894.","Hey [FIRSTNAME_1], did you remember to pay the course fee from account [ACCOUNTNAME_1]? Please check and reply to me on this number: [PHONENUMBER_1].",(86) 0206 7894,O
639,"Mrs. Hayden Jaden Wolf, a Cisgender woman of 60 residing in Powys, has requested a psychoanalysis session. Please contact her at 04-44.36-10-85.","[PREFIX_1] [FIRSTNAME_1] [MIDDLENAME_1] [LASTNAME_1], a [GENDER_1] of [AGE_1] residing in [COUNTY_1], has requested a psychoanalysis session. Please contact her at [PHONENUMBER_1].",04-44.36-10-85,O
640,Data head Dr. Ms. requires your 003-648 2873 for further communication.,[JOBAREA_1] head [PREFIX_1] [PREFIX_2] requires your [PHONENUMBER_1] for further communication.,003-648 2873,O
641,"Please find attached the educational leadership questionnaire responses in a file. These were put together by Hills, Kunde and Wolff. Contact (36)-0486-2371 for clarifications.",Please find attached the educational leadership questionnaire responses in a file. These were put together by [COMPANYNAME_1]. Contact [PHONENUMBER_1] for clarifications.,(36)-0486-2371,O
642,Current focus: cost optimization in Creative. Can we discuss potential plans via call on +777 821 897-4611?,Current focus: cost optimization in [JOBAREA_1]. Can we discuss potential plans via call on [PHONENUMBER_1]?,+777 821 897-4611,TEL
643,"Dear Krystina59, Review past sales data from https://sniveling-silence.org/ and make sales projections for the next year. Please finish the report by 5 tomorrow and send to Forest15@hotmail.com. Call me at +63-746-669 6302 if any issues.","Dear [USERNAME_1], Review past sales data from [URL_1] and make sales projections for the next year. Please finish the report by [TIME_1] tomorrow and send to [EMAIL_1]. Call me at [PHONENUMBER_1] if any issues.",+63-746-669 6302,O
644,"Subject: Educational Funding Request. Anika would like to apply for the educational funding. Account Name: Home Loan Account, Account Number: 58729493, Requested Amount: Bs935213. For more information, reach out via 04349.00474 or Jammie3@yahoo.com.","Subject: Educational Funding Request. [FIRSTNAME_1] would like to apply for the educational funding. Account Name: [ACCOUNTNAME_1], Account Number: [ACCOUNTNUMBER_1], Requested Amount: [CURRENCYSYMBOL_1][AMOUNT_1]. For more information, reach out via [PHONENUMBER_1] or [EMAIL_1].",04349.00474,O
645,"Book 073-903 2230 for school dance rehearsals. Require larger space due to 5'1"".",Book [PHONENUMBER_1] for school dance rehearsals. Require larger space due to [HEIGHT_1].,073-903 2230,O
646,"We're excited to welcome you to our literacy program! I'll meet you at building number 5870. For any questions, please do not hesitate to contact me at 085-573.7047 or Dasia37@yahoo.com.","We're excited to welcome you to our literacy program! I'll meet you at building number [BUILDINGNUMBER_1]. For any questions, please do not hesitate to contact me at [PHONENUMBER_1] or [EMAIL_1].",085-573.7047,O
647,"Please find vendor report attached for Calhoun County region. For queries, contact +77 470-617-7125.","Please find vendor report attached for [COUNTY_1] region. For queries, contact [PHONENUMBER_1].",+77 470-617-7125,O
648,"Hello, I am writing to request an appointment with a psycho-oncology specialist for Miss Robin at Grampian Hospital. Please contact me at +44.202-422-8995. I can be reached on weekdays after 11.","Hello, I am writing to request an appointment with a psycho-oncology specialist for [PREFIX_1] [MIDDLENAME_1] at [COUNTY_1] Hospital. Please contact me at [PHONENUMBER_1]. I can be reached on weekdays after [TIME_1].",+44.202-422-8995,O
649,"To protect our brand, we've decided to file for trademark protection. You can reach the Consultant at N Bridge Street on this number for further instructions: 003-8922069.","To protect our brand, we've decided to file for trademark protection. You can reach the [JOBTYPE_1] at [STREET_1] on this number for further instructions: [PHONENUMBER_1].",003-8922069,O
650,"Greetings Prohaska, we've received an insurance claim from your end. However, we noticed an unusual IP address 173.181.207.121. Please confirm if that's you or reach me directly at +891.089-006.3924.","Greetings [LASTNAME_1], we've received an insurance claim from your end. However, we noticed an unusual IP address [IPV4_1]. Please confirm if that's you or reach me directly at [PHONENUMBER_1].",+891.089-006.3924,TEL
651,"For the upcoming field trip, parent chaperones are requested. Interested parties in 85024 area, call 07 8428 0559. Complete details including trip expenses to be handled via 858, will be discussed over the call.","For the upcoming field trip, parent chaperones are requested. Interested parties in [ZIPCODE_1] area, call [PHONENUMBER_1]. Complete details including trip expenses to be handled via [CREDITCARDCVV_1], will be discussed over the call.",07 8428 0559,TEL
652,"Regarding your accident with VIN FXLRMHHRLKRL86359 on 1978-10-22T09:32:17.320Z, we've reviewed the documents sent. We'll be in touch shortly. In case you wish to contact us, please call us at +91 787-387.0360or email us at Stuart.Greenholt@yahoo.com.","Regarding your accident with VIN [VEHICLEVIN_1] on [DATE_1], we've reviewed the documents sent. We'll be in touch shortly. In case you wish to contact us, please call us at [PHONENUMBER_1]or email us at [EMAIL_1].",+91 787-387.0360,O
653,"I am contacting you on behalf of Sherwood Rory, who was in an accident on 2014-01-13T04:49:46.900Z. Please refer to our website at https://descriptive-double.org, and reach out to us via phone at (29).0830 6085 or email at Javier_Ernser9@yahoo.com.","I am contacting you on behalf of [FIRSTNAME_1] [MIDDLENAME_1], who was in an accident on [DATE_1]. Please refer to our website at [URL_1], and reach out to us via phone at [PHONENUMBER_1] or email at [EMAIL_1].",(29).0830 6085,O
654,"Parents in North Leanne, consider participating in Reilly's study on school readiness on https://subdued-clay.info/. Reach +098.010.635-6981 or Fern_Windler67@hotmail.com for queries.","Parents in [CITY_1], consider participating in [FIRSTNAME_1]'s study on school readiness on [URL_1]. Reach [PHONENUMBER_1] or [EMAIL_1] for queries.",+098.010.635-6981,TEL
655,"Dear Miss Waters, as your counselor, I encourage open dialogue without fear. Feel free to get back to me on +195.63 419 8895","Dear [PREFIX_1] [LASTNAME_1], as your counselor, I encourage open dialogue without fear. Feel free to get back to me on [PHONENUMBER_1]",+195.63 419 8895,O
656,"Patient Freddie Phoenix Harber, your 1955-09-28T20:17:36.915Z appointment has been cancelled. Please call us at (119) 0969127 to reschedule.","Patient [FIRSTNAME_1] [MIDDLENAME_1] [LASTNAME_1], your [DATE_1] appointment has been cancelled. Please call us at [PHONENUMBER_1] to reschedule.",(119) 0969127,O
657,Kacey reached out through our hotline from Kuhicborough. She needs urgent assistance. Please follow the crisis intervention protocol and reach out to her at 080 6192 9567.,[FIRSTNAME_1] reached out through our hotline from [CITY_1]. She needs urgent assistance. Please follow the crisis intervention protocol and reach out to her at [PHONENUMBER_1].,080 6192 9567,O
658,"Payments for our stress management webinars can be made using cryptocurrency addresses like 11KorN8pyYGPVv9PYzejVjU32DFF8, 0xb8ed57ef09051b3082cbfca332d10ce66f63a7e9 or on Pataca account with account number 30653207. For more assistance, contact me on 07.5066.5872.","Payments for our stress management webinars can be made using cryptocurrency addresses like [BITCOINADDRESS_1], [ETHEREUMADDRESS_1] or on [CURRENCY_1] account with account number [ACCOUNTNUMBER_1]. For more assistance, contact me on [PHONENUMBER_1].",07.5066.5872,O
659,"I need to understand the licensing needs for my latest invention in detail. Please get back me on 039 7103718. I am located at Suite 325, Dumfries and Galloway.","I need to understand the licensing needs for my latest invention in detail. Please get back me on [PHONENUMBER_1]. I am located at [SECONDARYADDRESS_1], [COUNTY_1].",039 7103718,TEL
660,Dr. Hermann Rice will visit the oncology department for her regular check-up. Her contact number is 070.3619.7030.,[PREFIX_1] [FIRSTNAME_1] [LASTNAME_1] will visit the oncology department for her regular check-up. Her contact number is [PHONENUMBER_1].,070.3619.7030,O
661,"Parker, since you are 54 years old years, attending Legal Education courses at the campus is optional for you. Contact us at 4098-127-3838 for remote classes option.","[MIDDLENAME_1], since you are [AGE_1] years, attending Legal Education courses at the campus is optional for you. Contact us at [PHONENUMBER_1] for remote classes option.",4098-127-3838,O
662,"We're expecting a new patient, Rodrick Hickle, in the Oncology department. For any financial considerations, kindly contact her through her number, 8884.229 5269.","We're expecting a new patient, [FIRSTNAME_1] [LASTNAME_1], in the Oncology department. For any financial considerations, kindly contact her through her number, [PHONENUMBER_1].",8884.229 5269,O
663,"Hello, I wish to access the Educational Fund. Account Name: Home Loan Account, Account Number: 24187950. Required Amount: L176.7222k. Kindly reach back at my email: Makenna_Schneider@gmail.com or phone number: 01772 127974. Regards, Miss Darlene Wilkinson.","Hello, I wish to access the Educational Fund. Account Name: [ACCOUNTNAME_1], Account Number: [ACCOUNTNUMBER_1]. Required Amount: [CURRENCYSYMBOL_1][AMOUNT_1]. Kindly reach back at my email: [EMAIL_1] or phone number: [PHONENUMBER_1]. Regards, [PREFIX_1] [FIRSTNAME_1] [LASTNAME_1].",01772 127974,O
664,"Dear Kattie, this is to confirm your upcoming appointment with us on June 3, 1993. The session will take place at our East Busterstad location. Please reply at Akeem72@yahoo.com or call +09.46.867.7638 if any changes are needed.","Dear [FIRSTNAME_1], this is to confirm your upcoming appointment with us on [DATE_1]. The session will take place at our [CITY_1] location. Please reply at [EMAIL_1] or call [PHONENUMBER_1] if any changes are needed.",+09.46.867.7638,O
665,Try to reach out to Ryder McCullough at (67) 2825-3587. They oversee plant operations for Morgan County.,Try to reach out to [FIRSTNAME_1] [LASTNAME_1] at [PHONENUMBER_1]. They oversee plant operations for [COUNTY_1].,(67) 2825-3587,O
666,"Your lecture on endocrinology dynamics appreciated, Ms.. A meeting to discuss the follow-up webinar can be arranged at 02/07/1936 at 13:04. Contact +06 267.983 5486 for any issues.","Your lecture on endocrinology dynamics appreciated, [PREFIX_1]. A meeting to discuss the follow-up webinar can be arranged at [DATE_1] at [TIME_1]. Contact [PHONENUMBER_1] for any issues.",+06 267.983 5486,O
667,"Helmer18, please be cautious on disclosing patient details (47-584870-674605-2, (924) 2692122, 379 53 8188) as it escalates ethical questions. Let's have a quick meeting with Carli and Fadel on 19/07/1921.","[USERNAME_1], please be cautious on disclosing patient details ([PHONEIMEI_1], [PHONENUMBER_1], [SSN_1]) as it escalates ethical questions. Let's have a quick meeting with [FIRSTNAME_1] and [LASTNAME_1] on [DATE_1].",(924) 2692122,O
668,"Important update: We have restructured our student wellbeing program. Visit https://sarcastic-great-grandmother.org to see the details about the new plan. If you have any questions, please contact Principal Communications Engineer Electa Kassulke at Shania14@gmail.com or (944)-6667495. Sincerely, Lizzie","Important update: We have restructured our student wellbeing program. Visit [URL_1] to see the details about the new plan. If you have any questions, please contact [JOBTITLE_1] [FIRSTNAME_1] [LASTNAME_1] at [EMAIL_1] or [PHONENUMBER_1]. Sincerely, [FIRSTNAME_2]",(944)-6667495,TEL
669,"Mohammad, your Athletic Scholarship application for Yukon is past due! Send it to Everette Center 263, Passaic, Louisiana soon. Reach out at +71-77 700-7786 for help.","[FIRSTNAME_1], your Athletic Scholarship application for [STATE_1] is past due! Send it to [STREET_1] [BUILDINGNUMBER_1], [CITY_1], [STATE_2] soon. Reach out at [PHONENUMBER_1] for help.",+71-77 700-7786,O
670,"Mozilla/5.0 (Windows; U; Windows NT 6.0) AppleWebKit/536.0.0 (KHTML, like Gecko) Chrome/39.0.896.0 Safari/536.0.0 shows that this incident happened in Jolieside. I'm forwarding the details to Camila's phone number (+473.802 076.1878).",[USERAGENT_1] shows that this incident happened in [CITY_1]. I'm forwarding the details to [FIRSTNAME_1]'s phone number ([PHONENUMBER_1]).,+473.802 076.1878,TEL
671,"We would like to invite you, Schmidt, to our upcoming psycho-oncology seminar taking place on 28/09/1947. Please confirm participation via the link: https://noteworthy-trophy.name. For queries, email us Herbert.Collins30@yahoo.com or call at 080 3910031.","We would like to invite you, [LASTNAME_1], to our upcoming psycho-oncology seminar taking place on [DATE_1]. Please confirm participation via the link: [URL_1]. For queries, email us [EMAIL_1] or call at [PHONENUMBER_1].",080 3910031,TEL
672,"Watson, would you be interested in volunteering as a mentor in our adult literacy program? Contact me, Suzanne Ritchie, at 07.3439.8833.","[FIRSTNAME_1], would you be interested in volunteering as a mentor in our adult literacy program? Contact me, [FIRSTNAME_2] [LASTNAME_1], at [PHONENUMBER_1].",07.3439.8833,O
673,We had to block a few IPs 115.105.120.51 due to violation of our terms and conditions. Please contact the administration at 0444-47430020 to address the issue.,We had to block a few IPs [IP_1] due to violation of our terms and conditions. Please contact the administration at [PHONENUMBER_1] to address the issue.,0444-47430020,O
674,Global Intranet Liaison needed for our school. The candidate should have experience in Directives. Interested candidates contact our HR representative at +25 518 312 7914. Please avoid phone calls during school hours.,[JOBTITLE_1] needed for our school. The candidate should have experience in [JOBAREA_1]. Interested candidates contact our HR representative at [PHONENUMBER_1]. Please avoid phone calls during school hours.,+25 518 312 7914,O
675,Literacy Workshop on 8/14 in Male to female's Books at Lake Renton. Confirm at Karine_Krajcik@gmail.com or 09 37.71.60-04.,Literacy Workshop on [DATE_1] in [GENDER_1]'s Books at Lake [CITY_1]. Confirm at [EMAIL_1] or [PHONENUMBER_1].,09 37.71.60-04,O
676,"For appointments regarding policy implementation discussions, contact our management at (935) 6054747 and provide them with your 15th August for verification.","For appointments regarding policy implementation discussions, contact our management at [PHONENUMBER_1] and provide them with your [DOB_1] for verification.",(935) 6054747,O
677,Your remaining group therapy balance is $604140.80. Make the payment by end of month. Contact us at +65 465-337-4982 for any queries.,Your remaining group therapy balance is [CURRENCYSYMBOL_1][AMOUNT_1]. Make the payment by end of month. Contact us at [PHONENUMBER_1] for any queries.,+65 465-337-4982,O
678,Teacher's assistant contact detail: 025.254 2308. She's resolved Northeast wing's issues before. Works effectively.,Teacher's assistant contact detail: [PHONENUMBER_1]. She's resolved [ORDINALDIRECTION_1] wing's issues before. Works effectively.,025.254 2308,O
679,"Please note, your credit card details (0098712703968746 with CVV 829) are due for update. Call 090 7069 2820 to update.","Please note, your credit card details ([CREDITCARDNUMBER_1] with CVV [CREDITCARDCVV_1]) are due for update. Call [PHONENUMBER_1] to update.",090 7069 2820,O
680,"To have access to medical records, kindly provide your IMEI Number 69-038851-956204-9 for phone verification. For records of Male patients, we require additional information due to a system update. Please confirm the following: Secondary Address Apt. 302 and DOB 9th March. Call us at 098-1021.9790 for additional help.","To have access to medical records, kindly provide your IMEI Number [PHONEIMEI_1] for phone verification. For records of [SEX_1] patients, we require additional information due to a system update. Please confirm the following: Secondary Address [SECONDARYADDRESS_1] and DOB [DOB_1]. Call us at [PHONENUMBER_1] for additional help.",098-1021.9790,O
681,"Greetings! As a follow up, we are again organizing tutoring classes. Please confirm your ward's attendance. You can contact us for more details at (043)-1808749 or Dayne.Larkin-Schiller47@gmail.com.","Greetings! As a follow up, we are again organizing tutoring classes. Please confirm your ward's attendance. You can contact us for more details at [PHONENUMBER_1] or [EMAIL_1].",(043)-1808749,TEL
682,"Larry64 is called for an arbitration hearing on August 31, 1987. Please contact us at +744.374-365-3874 and provide us with your LTC address, Lyp1ndFBju9ZL9LJVDTjCDcs6U.","[USERNAME_1] is called for an arbitration hearing on [DATE_1]. Please contact us at [PHONENUMBER_1] and provide us with your LTC address, [LITECOINADDRESS_1].",+744.374-365-3874,TEL
683,"A good educational leader makes informed decisions. These leaders rely on Opera/13.48 (X11; Linux i686; U; EN Presto/2.9.189 Version/11.00), with communication channels open via 012.630-3594.","A good educational leader makes informed decisions. These leaders rely on [USERAGENT_1], with communication channels open via [PHONENUMBER_1].",012.630-3594,TEL
684,"Serving D'Amoreborough and surrounding counties, Gusikowski, Quigley and Hettinger leads the pharma industry with products from their renowned Mobility division. Find out more about our products by visiting https://proper-prayer.org or calling +910.232.885-7878.","Serving [CITY_1] and surrounding counties, [COMPANYNAME_1] leads the pharma industry with products from their renowned [JOBAREA_1] division. Find out more about our products by visiting [URL_1] or calling [PHONENUMBER_1].",+910.232.885-7878,TEL
685,"At Renner - Dickinson, we are committed to providing a safe work environment around [-27.9308,45.5943]. Please refer to the attached safety guide and call 3804 657.7298 for further inquiries. We really appreciate your time and dedication to safety.","At [COMPANYNAME_1], we are committed to providing a safe work environment around [NEARBYGPSCOORDINATE_1]. Please refer to the attached safety guide and call [PHONENUMBER_1] for further inquiries. We really appreciate your time and dedication to safety.",3804 657.7298,O
686,"Good day Dr., we would like to inform you that the business sustainability report for your account number 24595132 under the account name Investment Account is prepared by Dynamic Solutions Strategist. Please access the report using the following URL: https://cheery-shofar.name/. Should you need help, please contact (613)-8436842. The password to access the file is DHCrtJuPxxDN.","Good day [PREFIX_1], we would like to inform you that the business sustainability report for your account number [ACCOUNTNUMBER_1] under the account name [ACCOUNTNAME_1] is prepared by [JOBTITLE_1]. Please access the report using the following URL: [URL_1]. Should you need help, please contact [PHONENUMBER_1]. The password to access the file is [PASSWORD_1].",(613)-8436842,TEL
687,"Patient Jo Dibbert of Male to female trans woman and aged 50 years old has been referred to the oncology department. Important details: 99-705602-210452-2, 053 931.2903 and Savings Account are provided. The consultation fee is ₮25.038k.","Patient [FIRSTNAME_1] [LASTNAME_1] of [GENDER_1] and aged [AGE_1] has been referred to the oncology department. Important details: [PHONEIMEI_1], [PHONENUMBER_1] and [ACCOUNTNAME_1] are provided. The consultation fee is [CURRENCYSYMBOL_1][AMOUNT_1].",053 931.2903,TEL
688,We're launching a fund for underprivileged kids in Newfoundland and Labrador. First phase has Syrian Pound0.00b set aside. Appreciate your strategies at our official website https://ruddy-conviction.info/. Contact us: (297) 7753586.,We're launching a fund for underprivileged kids in [STATE_1]. First phase has [CURRENCY_1][AMOUNT_1] set aside. Appreciate your strategies at our official website [URL_1]. Contact us: [PHONENUMBER_1].,(297) 7753586,O
689,"Dear Joesph Mraz, We're updating the privacy policy of Rippin, Stokes and Becker to comply with Sports and Entertainment law. Please accept the changes by clicking this link https://quixotic-offset.name. For any issues, contact us +033 18 147 2569 or Kiel_Jacobi6@yahoo.com.","Dear [FIRSTNAME_1] [LASTNAME_1], We're updating the privacy policy of [COMPANYNAME_1] to comply with Sports and Entertainment law. Please accept the changes by clicking this link [URL_1]. For any issues, contact us [PHONENUMBER_1] or [EMAIL_1].",+033 18 147 2569,O
690,"Our school's gifted program now includes a specialized foreign language module. For additional information, contact Norbert at 03350 076092.","Our school's gifted program now includes a specialized foreign language module. For additional information, contact [FIRSTNAME_1] at [PHONENUMBER_1].",03350 076092,O
691,The recent tax law requires monitoring of Personal Loan Account number 74475192. Transactions with 7873061689468655 card issued by visa with CVV 032 need confirmation. Contact me at +543.800.187 1157.,The recent tax law requires monitoring of [ACCOUNTNAME_1] number [ACCOUNTNUMBER_1]. Transactions with [MASKEDNUMBER_1] card issued by [CREDITCARDISSUER_1] with CVV [CREDITCARDCVV_1] need confirmation. Contact me at [PHONENUMBER_1].,+543.800.187 1157,TEL
692,"Hi Brooklyn, if Noemy needs any help with the project, they can contact (35).4620-3046.","Hi [MIDDLENAME_1], if [FIRSTNAME_1] needs any help with the project, they can contact [PHONENUMBER_1].",(35).4620-3046,O
693,"New to our city Youngstown, we extend an invitation to join our literacy programs. If interested, please contact Hal at 086-224 4863.","New to our city [CITY_1], we extend an invitation to join our literacy programs. If interested, please contact [FIRSTNAME_1] at [PHONENUMBER_1].",086-224 4863,O
694,"Dear Ruben, my son is struggling with English literature. I saw your name on the tutor list. Can I contact you on 0564-13233323?","Dear [FIRSTNAME_1], my son is struggling with English literature. I saw your name on the tutor list. Can I contact you on [PHONENUMBER_1]?",0564-13233323,O
695,Please contact Female to male transgender man Leo MacGyver at +55 383 115.2713 regarding a Civil Rights complaint against Ullrich Group.,Please contact [GENDER_1] [FIRSTNAME_1] [LASTNAME_1] at [PHONENUMBER_1] regarding a Civil Rights complaint against [COMPANYNAME_1].,+55 383 115.2713,O
696,Submit your operations report and notes about the new deal with Pacocha - Roob to Bertram Erdman at (44)-3534.3441.,Submit your operations report and notes about the new deal with [COMPANYNAME_1] to [FIRSTNAME_1] [LASTNAME_1] at [PHONENUMBER_1].,(44)-3534.3441,O
697,"Dear Ms. Kihn of Cummings - Lynch, I am a 64 years year old Demigender looking for trusted chronic disease management. Please contact me either by phone at +877-463-950-9785 or via email Maybell_Effertz@hotmail.com.","Dear [PREFIX_1] [LASTNAME_1] of [COMPANYNAME_1], I am a [AGE_1] year old [GENDER_1] looking for trusted chronic disease management. Please contact me either by phone at [PHONENUMBER_1] or via email [EMAIL_1].",+877-463-950-9785,TEL
698,"Dahlia Corkery, our new digital library platform is live at https://minty-cinder.info. You can log in using your username - Briana.Pfeffer. Contact us at 03.3472.1387 should you need any help.","[FIRSTNAME_1] [LASTNAME_1], our new digital library platform is live at [URL_1]. You can log in using your username - [USERNAME_1]. Contact us at [PHONENUMBER_1] should you need any help.",03.3472.1387,O
699,"Hi Una, our new imaging center is due to open next week at the Northeast. We're sending this Beaulah_Kiehn84@yahoo.com to invite you to our opening event. R.S.V.P using phone 01.1975-7449.","Hi [FIRSTNAME_1], our new imaging center is due to open next week at the [ORDINALDIRECTION_1]. We're sending this [EMAIL_1] to invite you to our opening event. R.S.V.P using phone [PHONENUMBER_1].",01.1975-7449,O
700,"For Delpha.Connelly12, whom we mentioned in the contract, you can reach via their provided contact 3871 901-1288. Always use https://simple-feather.com for all project-related submissions.","For [USERNAME_1], whom we mentioned in the contract, you can reach via their provided contact [PHONENUMBER_1]. Always use [URL_1] for all project-related submissions.",3871 901-1288,O
