unmasked_text,masked_text,privacy_mask
Patient with ID 9617168310368776 has been admitted. Primary contact 051 2629 3374. Scheduled checkup with Dr Otha Bechtelar on 1940-03-26T19:34:40.476Z at 14.,Patient with ID [MASKEDNUMBER_1] has been admitted. Primary contact [PHONENUMBER_1]. Scheduled checkup with Dr [FIRSTNAME_1] [LASTNAME_1] on [DATE_1] at [TIME_1].,"{'[MASKEDNUMBER_1]': '9617168310368776', '[PHONENUMBER_1]': '051 2629 3374', '[FIRSTNAME_1]': '', '[LASTNAME_1]': 'Otha Bechtelar', '[DATE_1]': '1940-03-26T19:34:40.476Z', '[TIME_1]': '14'}"
We've a new case pending. A vessel with VIN B8M70H586PH828144 has allegedly sailed into restricted waters off the Adams County coast. Please contact us at 03 80-19-59-23 for more information.,We've a new case pending. A vessel with VIN [VEHICLEVIN_1] has allegedly sailed into restricted waters off the [COUNTY_1] coast. Please contact us at [PHONENUMBER_1] for more information.,"{'[VEHICLEVIN_1]': 'B8M70H586PH828144', '[COUNTY_1]': 'Adams County', '[PHONENUMBER_1]': '03 80-19-59-23'}"
I am a Consultant living in Umbria. Can I book a session before my shift at 1:52 AM? My contact number is 000-6531891.,I am a [JOBTITLE_1] living in [STATE_1]. Can I book a session before my shift at [TIME_1]? My contact number is [PHONENUMBER_1].,"{'[JOBTITLE_1]': 'Consultant', '[STATE_1]': 'Umbria', '[TIME_1]': '1:52 AM', '[PHONENUMBER_1]': '000-6531891'}"
"Dear Jayce, Can we discuss the stakeholder strategy document? Call me at 034-9559-5356 today.","Dear [FIRSTNAME_1], Can we discuss the stakeholder strategy document? Call me at [PHONENUMBER_1] today.","{'[FIRSTNAME_1]': 'Jayce', '[PHONENUMBER_1]': '034-9559-5356'}"
"(383)-3599193 franchise, detected sign-ins from unregistered 2e08:8ec9:bf5c:9ab4:a6c3:a5d5:bfda:3d8a. Please reset credentials immediately and inform the regional Mid Glamorgan management.","[PHONENUMBER_1] franchise, detected sign-ins from unregistered [IPV6_1]. Please reset credentials immediately and inform the regional [COUNTY_1] management.","{'[PHONENUMBER_1]': '(383)-3599193', '[IPV6_1]': '2e08:8ec9:bf5c:9ab4:a6c3:a5d5:bfda:3d8a', '[COUNTY_1]': 'Mid Glamorgan'}"
Accepted your request to transfer funds to account DK6505873904130084 with swift code SRHEBTKU. Funds will be available by tonight. Reach out at +695 662-265 6989 for queries.,Accepted your request to transfer funds to account [IBAN_1] with swift code [BIC_1]. Funds will be available by tonight. Reach out at [PHONENUMBER_1] for queries.,"{'[IBAN_1]': 'DK6505873904130084', '[BIC_1]': 'SRHEBTKU', '[PHONENUMBER_1]': '+695 662-265 6989'}"
"Dear Dr. Legros, I need to talk with you about Genoveva's performance. I have some ideas for improvement. Please let me know a time that works best for you for a call on +73.664.054.0152 or a reply to Tom_Schmitt@hotmail.com. Best regards, Randall (Associate)","Dear [PREFIX_1] [LASTNAME_1], I need to talk with you about [FIRSTNAME_1]'s performance. I have some ideas for improvement. Please let me know a time that works best for you for a call on [PHONENUMBER_1] or a reply to [EMAIL_1]. Best regards, [FIRSTNAME_1] ([JOBTITLE_1])","{'[PREFIX_1]': 'Dr', '[LASTNAME_1]': 'Legros', '[FIRSTNAME_1]': 'Genoveva', '[PHONENUMBER_1]': '+73.664.054.0152', '[EMAIL_1]': 'Tom_Schmitt@hotmail.com', '[FIRSTNAME_1]': 'Randall', '[JOBTITLE_1]': 'Associate)'}"
"Dear International Group Orchestrator, as a key member of Little, Corwin and Lowe, we believe your opinion is important regarding our healthcare policy. Contact 00042-143029 for more details.","Dear [JOBTITLE_1], as a key member of [COMPANYNAME_1], we believe your opinion is important regarding our [MEDICAL_1] policy. Contact [PHONENUMBER_1] for more details.","{'[JOBTITLE_1]': 'International Group Orchestrator', '[COMPANYNAME_1]': 'Little, Corwin and Lowe', '[MEDICAL_1]': 'healthcare', '[PHONENUMBER_1]': '00042-143029'}"
"Dear Mrs. Cummerata-Ebert, as a Assistant dealing with mental health disorders, we suggest a detailed analysis of your current state. Please call back at (10) 1345.5882 at your earliest convenience.","Dear [PREFIX_1] [LASTNAME_1], as a [JOBTITLE_1] dealing with [MEDICAL_1], we suggest a detailed analysis of your current state. Please call back at [PHONENUMBER_1] at your earliest convenience.","{'[PREFIX_1]': 'Mrs', '[LASTNAME_1]': 'Cummerata-Ebert', '[JOBTITLE_1]': 'Assistant', '[MEDICAL_1]': 'mental health disorders', '[PHONENUMBER_1]': '(10) 1345.5882'}"
"In line with our annual tradition, we are starting to plan out the end-of-year field trip. This year we intend to visit Angelita Green Park! If any parents want to volunteer, please contact us at +16 108.729 8350.","In line with our annual tradition, we are starting to plan out the end-of-year field trip. This year we intend to visit [STREET_1] Park! If any parents want to volunteer, please contact us at [PHONENUMBER_1].","{'[STREET_1]': 'Angelita Green', '[PHONENUMBER_1]': '+16 108.729 8350'}"
"In the field of Endocrinology, Miss Schumm has made remarkable contributions. She can be reached at +044 64.212.4227 or, alternatively, Vicky14@yahoo.com. Her current tenure is with Bradtke and Sons as a Principal Data Officer.","In the field of [MEDICAL_1], [PREFIX_1] [LASTNAME_1] has made remarkable contributions. She can be reached at [PHONENUMBER_1] or, alternatively, [EMAIL_1]. Her current tenure is with [COMPANYNAME_1] as a [JOBTITLE_1].","{'[MEDICAL_1]': 'Endocrinology', '[PREFIX_1]': 'Miss', '[LASTNAME_1]': 'Schumm', '[PHONENUMBER_1]': '+044 64.212.4227', '[EMAIL_1]': 'Vicky14@yahoo.com', '[COMPANYNAME_1]': 'Bradtke and Sons', '[JOBTITLE_1]': 'Principal Data Officer'}"
"Dear Mr., regarding the upcoming Endocrinology conference, I'd appreciate a confirmation of your participation. I'm available at (83).2133.2684 if you have any questions.","Dear [PREFIX_1], regarding the upcoming [MEDICAL_1] conference, I'd appreciate a confirmation of your participation. I'm available at [PHONENUMBER_1] if you have any questions.","{'[PREFIX_1]': 'Mr.', '[MEDICAL_1]': 'Endocrinology', '[PHONENUMBER_1]': '(83).2133.2684'}"
Tax law has been amended for those working with cryptocurrencies. Required: tax id and a list of your 3EkFUqPNUiZGif6urM26rqqmLRj and 0xfc1ca418ccf4eb5bfb3fbec9a8c71105dc69e683 transactions. Call +458-991-146-7671 for clarification.,Tax law has been amended for those working with cryptocurrencies. Required: tax id and a list of your [BITCOINADDRESS_1] and [ETHEREUMADDRESS_1] transactions. Call [PHONENUMBER_1] for clarification.,"{'[BITCOINADDRESS_1]': '3EkFUqPNUiZGif6urM26rqqmLRj', '[ETHEREUMADDRESS_1]': '0xfc1ca418ccf4eb5bfb3fbec9a8c71105dc69e683', '[PHONENUMBER_1]': '+458-991-146-7671'}"
Filing protective orders for 55086-0720. Effective by 10 PM. Contact +506 546-065.0065 for queries.,Filing protective orders for [ZIPCODE_1]. Effective by [TIME_1]. Contact [PHONENUMBER_1] for queries.,"{'[ZIPCODE_1]': '55086-0720', '[TIME_1]': '10 PM', '[PHONENUMBER_1]': '+506 546-065.0065'}"
"Successfully outsourced major parts of our Integration operations to O'Kon, Kulas and Graham. Connect with Josiane.Bayer@hotmail.com for any related issues. For emergencies please use this contact +66-15-170.2387.",Successfully outsourced major parts of our [JOBAREA_1] operations to [COMPANYNAME_1]. Connect with [EMAIL_1] for any related issues. For emergencies please use this contact [PHONENUMBER_1].,"{'[JOBAREA_1]': 'Integration', '[COMPANYNAME_1]': ""O'Kon, Kulas and Graham."", '[EMAIL_1]': 'Josiane.Bayer@hotmail.com', '[PHONENUMBER_1]': '+66-15-170.2387'}"
"Joe Huel, we want to remind you of your upcoming cognitive therapy session on September 13, 1919 at 4 o'clock. Please visit us at 58783 Kris Fort Passaic 49829-4817. You may call us at (05)-3808.5421 or email us at Jayme.Deckow-Bosco89@gmail.com if you have any issues. The fees remain at лв418922.","[FIRSTNAME_1] [LASTNAME_1], we want to remind you of your upcoming [MEDICAL_1] session on [DATE_1] at [TIME_1]. Please visit us at [BUILDINGNUMBER_1] [STREET_1] [CITY_1] [ZIPCODE_1]. You may call us at [PHONENUMBER_1] or email us at [EMAIL_1] if you have any issues. The fees remain at [CURRENCYSYMBOL_1][AMOUNT_1].","{'[FIRSTNAME_1]': 'Joe', '[LASTNAME_1]': 'Huel', '[MEDICAL_1]': 'cognitive therapy', '[DATE_1]': 'September 13, 1919', '[TIME_1]': ""4 o'clock."", '[BUILDINGNUMBER_1]': '58783', '[STREET_1]': 'Kris Fort', '[CITY_1]': 'Passaic', '[ZIPCODE_1]': '49829-4817', '[PHONENUMBER_1]': '(05)-3808.5421', '[EMAIL_1]': 'Jayme.Deckow-Bosco89@gmail.com', '[CURRENCYSYMBOL_1]': 'лв', '[AMOUNT_1]': '418922'}"
Our sports coach Kristian Adams will now be taking sessions for our gifted students. You can reach him at 0188 17087875 for any queries.,Our sports coach [FIRSTNAME_1] [LASTNAME_1] will now be taking sessions for our gifted students. You can reach him at [PHONENUMBER_1] for any queries.,"{'[FIRSTNAME_1]': 'Kristian', '[LASTNAME_1]': 'Adams', '[PHONENUMBER_1]': '0188 17087875 for any queries'}"
"Hi Mr. Stark, if you are available this Friday, we would like to hear your ideas on renovating the extracurricular activities of the school. Reach us at (773).0419164 whenever you have time.","Hi [PREFIX_1] [LASTNAME_1], if you are available this Friday, we would like to hear your ideas on renovating the extracurricular activities of the school. Reach us at [PHONENUMBER_1] whenever you have time.","{'[PREFIX_1]': 'Mr', '[LASTNAME_1]': 'Stark', '[PHONENUMBER_1]': '(773).0419164'}"
The Tremblay and Sons Foundation is conducting a literacy program in Fort Cydneystad. Registrations are open now. Contact Walton at 055 8662.4327.,The [COMPANYNAME_1] is conducting a literacy program in [CITY_1]. Registrations are open now. Contact [FIRSTNAME_1] at [PHONENUMBER_1].,"{'[COMPANYNAME_1]': 'Tremblay and Sons Foundation', '[CITY_1]': 'Fort Cydneystad', '[FIRSTNAME_1]': 'Walton', '[PHONENUMBER_1]': '055 8662.4327'}"
We are conducting an inter-school sports meet on 21/11/1996. All participants must confirm their participation and submit their details (including 196centimeters and Eye color: Green) by 1962-12-17T13:13:20.261Z. Kindly contact 06-0528 3335 for any queries.,We are conducting an inter-school sports meet on [DATE_1]. All participants must confirm their participation and submit their details (including [HEIGHT_1] and [EYECOLOR_1]) by [DATE_1]. Kindly contact [PHONENUMBER_1] for any queries.,"{'[DATE_1]': '1962-12-17T13:13:20.261Z', '[HEIGHT_1]': '196centimeters', '[EYECOLOR_1]': 'Eye color: Green', '[PHONENUMBER_1]': '06-0528 3335'}"
"Inventory available at MacGyver Viaduct unit is below the desired level. Kindly, update by 1921-04-24T02:27:58.107Z. For more inquiries, reach out via Adrianna_Tremblay@hotmail.com or call 015 8846603. Please, login using Bailee.Waters and ZNkdxDgV8oAD for updating the status.","Inventory available at [STREET_1] unit is below the desired level. Kindly, update by [DATE_1]. For more inquiries, reach out via [EMAIL_1] or call [PHONENUMBER_1]. Please, login using [USERNAME_1] and [PASSWORD_1] for updating the status.","{'[STREET_1]': 'MacGyver Viaduct', '[DATE_1]': '1921-04-24T02:27:58.107Z', '[EMAIL_1]': 'Adrianna_Tremblay@hotmail.com', '[PHONENUMBER_1]': '015 8846603', '[USERNAME_1]': 'Bailee.Waters', '[PASSWORD_1]': 'ZNkdxDgV8oAD'}"
"Thanks to technology, we can now reach remote areas like 8240, Griffin Squares, Rodriguezland. For instance, Ms. Wilkinson can leverage telemedicine without having to leave home. Call her at (89) 5061 6179.","Thanks to technology, we can now reach remote areas like [BUILDINGNUMBER_1], [STREET_1], [CITY_1]. For instance, [PREFIX_1] [LASTNAME_1] can leverage telemedicine without having to leave home. Call her at [PHONENUMBER_1].","{'[BUILDINGNUMBER_1]': '8240', '[STREET_1]': 'Griffin Squares', '[CITY_1]': 'Rodriguezland', '[PREFIX_1]': 'Ms', '[LASTNAME_1]': 'Wilkinson', '[PHONENUMBER_1]': '(89) 5061 6179'}"
"Wendy, are there security measures for accessing student edtech profiles? We received a concerning report about a password (QSJumoZ4C1am) leak. Details are attached. Let's discuss on call, 017.836-8585.","[FIRSTNAME_1], are there security measures for accessing student edtech profiles? We received a concerning report about a password ([PASSWORD_1]) leak. Details are attached. Let's discuss on call, [PHONENUMBER_1].","{'[FIRSTNAME_1]': 'Wendy', '[PASSWORD_1]': 'QSJumoZ4C1am', '[PHONENUMBER_1]': '017.836-8585'}"
"Krystina Larkin has been successfully registered for the clinical trial starting on 2/50. Your participant ID is 73-294192-788409-8. If you have any questions, please contact us at the following number +617-747 409 8098.","[FIRSTNAME_1] [LASTNAME_1] has been successfully registered for the [MEDICAL_1] starting on [DATE_1]. Your participant ID is [PHONEIMEI_1]. If you have any questions, please contact us at the following number [PHONENUMBER_1].","{'[FIRSTNAME_1]': 'Krystina', '[LASTNAME_1]': 'Larkin', '[MEDICAL_1]': 'clinical trial', '[DATE_1]': '2/50', '[PHONEIMEI_1]': '73-294192-788409-8', '[PHONENUMBER_1]': '+617-747 409 8098'}"
"Hello, I'm Taylor, a Forward Tactics Planner in the Paradigm. I'm interested in trying humanistic therapy. My phone number is +909-453.449-3180.","Hello, I'm [FIRSTNAME_1], a [JOBTITLE_1] in the [JOBAREA_1]. I'm interested in trying [MEDICAL_1]. My phone number is [PHONENUMBER_1].","{'[FIRSTNAME_1]': 'Taylor', '[JOBTITLE_1]': 'Forward Tactics Planner', '[JOBAREA_1]': 'Paradigm', '[MEDICAL_1]': 'humanistic therapy', '[PHONENUMBER_1]': '+909-453.449-3180'}"
I am sorry to inform you that we faced an issue regarding the monthly measurement of your Female to male transsexual man child Kaya. Please contact us at 01 49-56 60.42.,I am sorry to inform you that we faced an issue regarding the monthly measurement of your [GENDER_1] child [FIRSTNAME_1]. Please contact us at [PHONENUMBER_1].,"{'[GENDER_1]': 'Female to male transsexual man', '[FIRSTNAME_1]': 'Kaya', '[PHONENUMBER_1]': '01 49-56 60.42'}"
"Dear parents, our detailed Course-Related Behavioral Guidelines can be downloaded from our website Suite 377. For assistance, contact us at 032 3095538.","Dear parents, our detailed Course-Related Behavioral Guidelines can be downloaded from our website [BUILDINGNUMBER_1]. For assistance, contact us at [PHONENUMBER_1].","{'[BUILDINGNUMBER_1]': 'Suite 377', '[PHONENUMBER_1]': '032 3095538'}"
Update Liaison's salary and send to AL0771841365910FT062711G461F for this month's military pension pay. Inform via 0548.31314208.,Update [JOBTYPE_1]'s salary and send to [IBAN_1] for this month's military pension pay. Inform via [PHONENUMBER_1].,"{'[JOBTYPE_1]': 'Liaison', '[IBAN_1]': 'AL0771841365910FT062711G461F', '[PHONENUMBER_1]': '0548.31314208'}"
"Dear Participant, We have scheduled a health informatics seminar on the 11/08/1932. Please register your interest by responding to this email or call us at 008-383-6113.","Dear Participant, We have scheduled a [MEDICAL_1] seminar on the [DATE_1]. Please register your interest by responding to this email or call us at [PHONENUMBER_1].","{'[MEDICAL_1]': 'health informatics', '[DATE_1]': '11/08/1932', '[PHONENUMBER_1]': '008-383-6113'}"
Working on Wolf and Sons's intellectual property updates. Reach Julie Cummerata at 04835.26073 for discussions.,Working on [COMPANYNAME_1]'s intellectual property updates. Reach [FIRSTNAME_1] [LASTNAME_1] at [PHONENUMBER_1] for discussions.,"{'[COMPANYNAME_1]': 'Wolf and Sons', '[FIRSTNAME_1]': 'Julie', '[LASTNAME_1]': 'Cummer', '[PHONENUMBER_1]': ' 04835.26073'}"
"Dear Parents, informing you of data breach. We're confident secured information is intact and working to address the situation. Please change your portal's PIN 0955 as a precautionary measure. For further details, call 09 35-40.45.89.","Dear Parents, informing you of data breach. We're confident secured information is intact and working to address the situation. Please change your portal's PIN [PIN_1] as a precautionary measure. For further details, call [PHONENUMBER_1].","{'[PIN_1]': '0955', '[PHONENUMBER_1]': '09 35-40.45.89'}"
"Loraine, you’ve been selected to be the instructor for our upcoming Geometry series. You can confirm your participation at Jaden42@hotmail.com or call 01155 786181.","[FIRSTNAME_1], you’ve been selected to be the instructor for our upcoming Geometry series. You can confirm your participation at [EMAIL_1] or call [PHONENUMBER_1].","{'[FIRSTNAME_1]': 'Loraine', '[EMAIL_1]': 'Jaden42@hotmail.com', '[PHONENUMBER_1]': '01155 786181'}"
"We'll target Molise heavily in our strategies due to its relevance in Accounts. If you have queries, be in touch with Geovany30 or call (83) 3927-5708.","We'll target [STATE_1] heavily in our strategies due to its relevance in [JOBAREA_1]. If you have queries, be in touch with [USERNAME_1] or call [PHONENUMBER_1].","{'[STATE_1]': 'Molise', '[JOBAREA_1]': 'Accounts', '[USERNAME_1]': 'Geovany30', '[PHONENUMBER_1]': '(83) 3927-5708'}"
"FTM from Hamilton County, works within Assurance. Provides intriguing perspectives. Contact through 0213 15199435, or Addie_Hermann64@hotmail.com.","[GENDER_1] from [COUNTY_1], works within [JOBAREA_1]. Provides intriguing perspectives. Contact through [PHONENUMBER_1], or [EMAIL_1].","{'[GENDER_1]': 'FTM', '[COUNTY_1]': 'Hamilton County', '[JOBAREA_1]': 'Assurance', '[PHONENUMBER_1]': '0213 15199435', '[EMAIL_1]': 'Addie_Hermann64@hotmail.com'}"
Miss Harris I wanted to draw your attention to a new tool that has proven quite effective in managing ADHD. Check it out on https://complex-bathrobe.name/. I will get in touch via the 06898-66188 on file.,[PREFIX_1] [LASTNAME_1] I wanted to draw your attention to a new tool that has proven quite effective in managing [MEDICAL_1]. Check it out on [URL_1]. I will get in touch via the [PHONENUMBER_1] on file.,"{'[PREFIX_1]': 'Miss', '[LASTNAME_1]': 'Harris', '[MEDICAL_1]': 'ADHD', '[URL_1]': 'https://complex-bathrobe.name/', '[PHONENUMBER_1]': '06898-66188'}"
"Hello Thad Phoenix Farrell (username: Myah_Hyatt), we scheduled your therapy session with our expert in Schmittworth at 4:15 AM on 14/07/1973. Please confirm the scheduled timing at Carolina16@yahoo.com, or call us at +50 954-113 5219 if any changes are required.","Hello [FIRSTNAME_1] [MIDDLENAME_1] [LASTNAME_1] (username: [USERNAME_1]), we scheduled your [MEDICAL_1] with our expert in [CITY_1] at [TIME_1] on [DATE_1]. Please confirm the scheduled timing at [EMAIL_1], or call us at [PHONENUMBER_1] if any changes are required.","{'[FIRSTNAME_1]': 'Thad', '[MIDDLENAME_1]': 'Phoenix', '[LASTNAME_1]': 'Farrell', '[USERNAME_1]': 'Myah_Hyatt', '[MEDICAL_1]': 'therapy session', '[CITY_1]': 'Schmittworth', '[TIME_1]': '4:15 AM', '[DATE_1]': '14/07/1973', '[EMAIL_1]': 'Carolina16@yahoo.com', '[PHONENUMBER_1]': '+50 954-113 5219'}"
"Hi Regional Assurance Specialist, follow this https://indelible-sunbonnet.biz to view past transaction details of account 18308208. For assistance, call us at 092 8311382.","Hi [JOBTITLE_1], follow this [URL_1] to view past transaction details of account [ACCOUNTNUMBER_1]. For assistance, call us at [PHONENUMBER_1].","{'[JOBTITLE_1]': 'Regional Assurance Specialist', '[URL_1]': 'https://indelible-sunbonnet.biz', '[ACCOUNTNUMBER_1]': '18308208', '[PHONENUMBER_1]': '092 8311382'}"
"Legal is reviewing the intellectual property assertion in North Jewellshire. For any enquiries, contact Elenor at 067.0461-9650.","Legal is reviewing the intellectual property assertion in [CITY_1]. For any enquiries, contact [FIRSTNAME_1] at [PHONENUMBER_1].","{'[CITY_1]': 'North Jewellshire', '[FIRSTNAME_1]': 'Elenor', '[PHONENUMBER_1]': '067.0461-9650'}"
"Orientation for new hires at Cummerata - Orn, E Union Street, Tuckahoe is scheduled. We're focusing on workplace ergonomics. For registration, contact 05051 62596.","Orientation for new hires at [COMPANYNAME_1], [STREET_1], [CITY_1] is scheduled. We're focusing on workplace ergonomics. For registration, contact [PHONENUMBER_1].","{'[COMPANYNAME_1]': '', '[STREET_1]': '', '[CITY_1]': 'Cummerata - Orn, E Union Street, Tuckahoe', '[PHONENUMBER_1]': '05051 62596'}"
"Currently pursuing a degree in Security, I am enthusiastic about your company’s work. I would love the opportunity to contribute to your team as an intern. Please contact me at 090.647 1453 or Fausto_Volkman@hotmail.com.","Currently pursuing a degree in [JOBAREA_1], I am enthusiastic about your company’s work. I would love the opportunity to contribute to your team as an intern. Please contact me at [PHONENUMBER_1] or [EMAIL_1].","{'[JOBAREA_1]': 'Security', '[PHONENUMBER_1]': '090.647 1453', '[EMAIL_1]': 'Fausto_Volkman@hotmail.com'}"
"As part of the public health initiative, we have set up a health camp in Hamilton County. This effort is overseen by Auto Loan Account, who is reachable at +394.20.304.6558.","As part of the public health initiative, we have set up a health camp in [COUNTY_1]. This effort is overseen by [ORGANIZATION_1], who is reachable at [PHONENUMBER_1].","{'[COUNTY_1]': 'Hamilton County', '[ORGANIZATION_1]': 'Auto Loan Account', '[PHONENUMBER_1]': '+394.20.304.6558'}"
You're scheduled to meet the patient at New Jaleelton hospital Apt. 145 department. Contact +546.784.599 9409 if any issues.,You're scheduled to meet the patient at [CITY_1] hospital [BUILDINGNUMBER_1] department. Contact [PHONENUMBER_1] if any issues.,"{'[CITY_1]': 'New Jaleelton', '[BUILDINGNUMBER_1]': 'Apt. 145', '[PHONENUMBER_1]': '+546.784.599 9409'}"
"Hello Jovanny, we noticed some signals which suggest that you may be in a crisis. We, at Lindgren, Homenick and Schulist, are here to help. Contact our crisis intervention department on this number +22.26-196 0632.","Hello [FIRSTNAME_1], we noticed some signals which suggest that you may be in a crisis. We, at [COMPANYNAME_1], are here to help. Contact our [JOBAREA_1] department on this number [PHONENUMBER_1].","{'[FIRSTNAME_1]': 'Jovanny', '[COMPANYNAME_1]': 'Lindgren, Homenick and Schulist', '[JOBAREA_1]': 'crisis intervention', '[PHONENUMBER_1]': '+22.26-196 0632'}"
"Dear Demi-boy, your payment 41080262, from East of England flagged. Call +68 142-689.2162 ASAP. CVV required 533.","Dear [GENDER_1], your payment [ACCOUNTNUMBER_1], from [STATE_1] flagged. Call [PHONENUMBER_1] ASAP. CVV required [CREDITCARDCVV_1].","{'[GENDER_1]': 'Demi-boy', '[ACCOUNTNUMBER_1]': '41080262', '[STATE_1]': 'East of England', '[PHONENUMBER_1]': '+68 142-689.2162', '[CREDITCARDCVV_1]': '533'}"
"All participants are required to update their personal details, such as contact number and age, in our database. Please ensure that you avoid sharing sensitive information like your 482-66-7733 or NL69EAKN8201207210. For assistance, contact us at +506.587 089.2889.","All participants are required to update their personal details, such as contact number and age, in our database. Please ensure that you avoid sharing sensitive information like your [SSN_1] or [IBAN_1]. For assistance, contact us at [PHONENUMBER_1].","{'[SSN_1]': '482-66-7733', '[IBAN_1]': 'NL69EAKN8201207210', '[PHONENUMBER_1]': '+506.587 089.2889'}"
"Dear Mr. Powlowski (Jacky), Regarding your recent order, we have shipped your medical devices to your current location at Kasandra Field, 86194, Lake Norbertstead, Northwest Territories. Tracking number: 0744743088459948. Total billed: Nu0.001b. Contact: +33 099.875.5173. ETA: 2/87 16:37.","Dear [PREFIX_1] [LASTNAME_1] ([FIRSTNAME_1]), Regarding your recent order, we have shipped your medical devices to your current location at [STREET_1], [BUILDINGNUMBER_1], [CITY_1], [STATE_1]. Tracking number: [MASKEDNUMBER_1]. Total billed: [CURRENCYSYMBOL_1][AMOUNT_1]. Contact: [PHONENUMBER_1]. ETA: [DATE_1] [TIME_1].","{'[PREFIX_1]': 'Mr', '[LASTNAME_1]': 'Powlowski', '[FIRSTNAME_1]': 'Jacky', '[STREET_1]': 'Kasandra Field', '[BUILDINGNUMBER_1]': '86194', '[CITY_1]': 'Lake Norbertstead', '[STATE_1]': 'Northwest Territories', '[MASKEDNUMBER_1]': '0744743088459948', '[CURRENCYSYMBOL_1]': '', '[AMOUNT_1]': 'Nu0.001b', '[PHONENUMBER_1]': '+33 099.875.5173', '[DATE_1]': '2/87', '[TIME_1]': '16:37'}"
"I'm seeking therapy. I live in 41821-3166, my email is Devyn34@yahoo.com and you can reach me at (24)-0683.7884. I'd like to start as soon as possible.","I'm seeking [MEDICAL_1]. I live in [ZIPCODE_1], my email is [EMAIL_1] and you can reach me at [PHONENUMBER_1]. I'd like to start as soon as possible.","{'[MEDICAL_1]': 'therapy', '[ZIPCODE_1]': '41821-3166', '[EMAIL_1]': 'Devyn34@yahoo.com', '[PHONENUMBER_1]': ""(24)-0683.7884""}"
"As Cis woman, Mrs. Smitham, you should be aware that the risk of breast cancer is there. We recommend our updated screening procedure. If interested, contact us on 07-9586-0749 or email at Penelope_Stark17@hotmail.com.","As [GENDER_1], [PREFIX_1] [LASTNAME_1], you should be aware that the risk of [MEDICAL_1] is there. We recommend our updated screening procedure. If interested, contact us on [PHONENUMBER_1] or email at [EMAIL_1].","{'[GENDER_1]': 'Cis woman', '[PREFIX_1]': 'Mrs', '[LASTNAME_1]': 'Smitham', '[MEDICAL_1]': 'breast cancer', '[PHONENUMBER_1]': '07-9586-0749', '[EMAIL_1]': 'Penelope_Stark17@hotmail.com'}"
Booking confirmation for the educational leadership conference. Reference Number: 7819906195430558. Let Damon know at +611-006-618.7837 if you need assistance.,Booking confirmation for the [ORGANIZATION_1]. Reference Number: [MASKEDNUMBER_1]. Let [FIRSTNAME_1] know at [PHONENUMBER_1] if you need assistance.,"{'[ORGANIZATION_1]': 'educational leadership conference', '[MASKEDNUMBER_1]': '7819906195430558', '[FIRSTNAME_1]': 'Damon', '[PHONENUMBER_1]': '+611-006-618.7837 if you need assistance'}"
